<?xml version="1.0" encoding="UTF-8" ?>

<algorithm
  xmlns:xsi="http://www.w3.org/2001/XMLSchema-instance"
  xmlns="AlgorithmNamespace"
  xsi:schemaLocation="AlgorithmNamespace Pandora.algorithm.xsd">

  <normal_info>
    <name>DummySnapshotAlgorithm</name>
    <author>niklas</author>
    <version>1</version>
    <type>algorithm</type>
    <supported_usecase>
      <usecase>snapshot</usecase>
    </supported_usecase>
    <multi_frame>
      <enable>0</enable>
      <frame_number>1</frame_number>
    </multi_frame>
  </normal_info>

  <run_info>
    <mode>off</mode>
    <manual>
      <key>pandora.algorithm.switcher.DummySnapshotAlgorithm</key>
      <value>on</value>
    </manual>
  </run_info>

  <capabilities>
    <max_width>0</max_width>
    <max_height>0</max_height>
    <preferredProcessOn>output</preferredProcessOn>
    <supported_format>
      <format>NV12_SEMI_PLANAR</format>
      <format>NV21_SEMI_PLANAR</format>
    </supported_format>
    <multi_instance_support>1</multi_instance_support>
    <pal_required>1</pal_required>
    <GL_required>0</GL_required>
  </capabilities>

  <debug_info>
    <check_performance>
      <enable>0</enable>
      <count>0</count>
    </check_performance>
    <dump_input_output>
      <enable>0</enable>
      <format>JPEG</format>
    </dump_input_output>
    <memory_control>
      <enable>0</enable>
      <max_size>10MB</max_size>
    </memory_control>
    <fd_control>
      <enable>0</enable>
      <max_number>0</max_number>
    </fd_control>
  </debug_info>

</algorithm>
